A2: 25 captures29 Dec 2002 - 15 Aug 2016

A1: May | B1: APR | C1: Aug
B2: 01
A3: 2012 | B3: 2016 | C3: 2017

A1: gtech pro/competition

A1: Test conditions: approx. 80 degrees, probably 500 ft. above sea level. Very early production model (one of the first few hundred). Firmware 1.0 (GTech will be offering firmware upgrades that can be done with a PC). I weigh 260 lbs., the tank was 3/4 full, bone stock truck with soft cover, so I entered a weight of 4,900 lbs. Calibrated twice. Bone stock 2002 engine, 1,800 miles on the odo. No wheelspin at all in any run. All times taken by left-foot braking and simultaneously lifting the brake and pressing the throttle. Did not load up the converter for the launch--just stomped it off of idle. Taken off of side of freeway with launch area from closed lanes. The unit may not have been level during the first run. Conclusions: Very consistent times, very inconsistent HP readings. As can be seen in the data below, the times were well within 1% of each other, most being about .5% off from run to run. Of course, the truck could have been running very inconsistently and the GTech could have been coincidentally off in the opposite direction on each run, but that seems unlikely. GTech recommends that multiple runs be averaged, with the worst 2 of 5 being disregarded. I have no idea what the truck actually runs in the 1/4 mile, so I cannot comment on absolute accuracy. I cannot explain why the HP readings were all over the map. The tach data may have something to do with the way HP is calculated, and I am not getting consistent tach readings, even after following the RPM calibration routine. Biggest pleasant surprises: More data points than I imagined (not all data is displayed below). Will do a full graphic replay in real time after each run! Biggest disappointment: Cannot measure 60-0 braking times or record maximum lateral g's. I guess I won't be selling my old GTech Pro after all. This is a huge disappointment! Hopefully this will be corrected in future versions of the software. The manual I have says "Pre-release manual" on the front. Full review to come.

B1: Run 1 | C1: diff from avg. | D1: Run 2 | E1: diff from avg. | F1: Run 3 | G1: diff from avg. | H1: Run 4 | I1: diff from avg. | J1: AVG
A2: 60 ft. (secs) | B2: 2.4990000000000001 | C2: =+(B2/$J$2)-1 -> -6.3618290258448118E-3 | D2: 2.5110000000000001 | E2: =+(D2/$J$2)-1 -> -1.5904572564610087E-3 | F2: 2.5179999999999998 | G2: =+(F2/$J$2)-1 -> 1.1928429423460063E-3 | H2: 2.532 | I2: =+(H2/$J$2)-1 -> 6.7594433399604803E-3 | J2: =(B2+D2+F2+H2)/4 -> 2.5150000000000001
A3: 1/8 mile (secs) | B3: 9.234 | C3: =+(B3/$J3)-1 -> -6.0547348026156467E-3 | D3: 9.3379999999999992 | E3: =+(D3/$J3)-1 -> 5.1397970991091668E-3 | F3: 9.3170000000000002 | G3: =+(F3/$J3)-1 -> 2.879362772799432E-3 | H3: 9.2720000000000002 | I3: =+(H3/$J3)-1 -> -1.9644250692930632E-3 | J3: =(B3+D3+F3+H3)/4 -> 9.2902500000000003
A4: 1/4 mile (secs.) | B4: 13.99 | C4: =+(B4/$J$4)-1 -> -7.3262022599471788E-3 | D4: 14.18 | E4: =+(D4/$J$4)-1 -> 6.1554290174372639E-3 | F4: 14.148999999999999 | G4: =+(F4/$J$4)-1 -> 3.9557944406007906E-3 | H4: 14.054 | I4: =+(H4/$J$4)-1 -> -2.7850211980913198E-3 | J4: =(B4+D4+F4+H4)/4 -> 14.093250000000001
A5: 1/4 mile (MPH) | F5: 103.04 | H5: 104.35
A6: 0-60 (secs.) | B6: 5.6340000000000003 | C6: =+(B7/$J7)-1 -> -1.2748061506111075E-2 | D6: 5.7939999999999996 | E6: =+(D7/$J7)-1 -> 1.5288912253033748E-2 | F6: 5.7370000000000001 | G6: =+(F7/$J7)-1 -> 5.3007403513383178E-3 | H6: 5.6619999999999999 | I6: =+(H7/$J7)-1 -> -7.8415910982607695E-3 | J6: =(B7+D7+F7+H7)/4 -> 5.7067499999999995
A7: HP | B7: 368.4 | C7: =+(B10/$J10)-1 -> 0.18228498074454413 | D7: 363.8 | E7: =+(D10/$J10)-1 -> 0.1675224646983311 | F7: 242.7 | G7: =+(F10/$J10)-1 -> -0.22111681643132231 | H7: 271.5 | I7: =+(H10/$J10)-1 -> -0.12869062901155337 | J7: =(B10+D10+F10+H10)/4 -> 311.6
A8: TQ | B8: 391.3 | C8: =+(B9/$J9)-1 -> 0.16000889350033365 | D8: 372.9 | E8: =+(D9/$J9)-1 -> 0.10546209145482832 | F8: 284.3 | G8: =+(F9/$J9)-1 -> -0.15719261839472309 | H8: 300.8 | I8: =+(H9/$J9)-1 -> -0.10827836656043865 | J8: =(B9+D9+F9+H9)/4 -> 337.32499999999999